{
  "id": "azincourt",
  "name": "Bataille d'Azincourt",
  "date": "1415-10-25",
  "year": 1415,
  "summary": "25 octobre 1415, jour de la Saint-Crépin. Après une nuit de pluie, l’armée d’Henri V, épuisée et affamée, barre la route de Calais entre les bois d’Azincourt et de Tramecourt. Les archers anglais s’avancent à portée d’arc et plantent leurs pieux. L’avant-garde française, à pied et serrée entre les deux bois, s’enlise dans les labours détrempés sous les volées ; les ailes de cavalerie chargent les archers. Derrière, la bataille principale et l’arrière-garde montée attendent leur tour.",
  "province": "prov_normandie",
  "province_name": "Artois",
  "terrain": "plains",
  "season": "autumn",
  "site": {
    "lon": 2.1395,
    "lat": 50.4595,
    "bearing_deg": 180,
    "place": "Azincourt"
  },
  "field": {
    "width_m": 2000,
    "depth_m": 1600,
    "line_gap_m": 500,
    "zone_depth_m": 450,
    "max_regiments_per_side": 160
  },
  "ground": "muddy",
  "relief": {
    "step_m": 20.0,
    "nx": 101,
    "nz": 81,
    "base_m": 105.9,
    "vertical_scale": 1.0,
    "heights_dm": [
      235,
      234,
      231,
      228,
      223,
      217,
      209,
      198,
      185,
      175,
      170,
      168,
      168,
      168,
      167,
      164,
      158,
      153,
      150,
      150,
      150,
      153,
      157,
      164,
      171,
      177,
      180,
      182,
      183,
      184,
      186,
      191,
      199,
      206,
      211,
      216,
      221,
      227,
      234,
      240,
      246,
      251,
      256,
      261,
      265,
      269,
      271,
      273,
      274,
      275,
      275,
      275,
      275,
      274,
      273,
      272,
      271,
      268,
      263,
      258,
      253,
      247,
      240,
      231,
      221,
      210,
      198,
      186,
      175,
      165,
      161,
      165,
      178,
      196,
      213,
      223,
      227,
      226,
      221,
      210,
      199,
      193,
      193,
      196,
      198,
      198,
      197,
      193,
      188,
      181,
      173,
      164,
      156,
      148,
      138,
      123,
      103,
      84,
      71,
      64,
      62,
      226,
      224,
      222,
      219,
      216,
      211,
      204,
      193,
      179,
      170,
      166,
      165,
      166,
      166,
      164,
      159,
      151,
      143,
      139,
      138,
      138,
      139,
      143,
      149,
      158,
      166,
      173,
      177,
      179,
      181,
      185,
      190,
      198,
      204,
      210,
      215,
      221,
      228,
      235,
      241,
      247,
      252,
      257,
      261,
      264,
      267,
      269,
      271,
      272,
      272,
      273,
      273,
      272,
      272,
      271,
      270,
      269,
      266,
      263,
      258,
      253,
      247,
      240,
      232,
      222,
      212,
      201,
      189,
      177,
      167,
      161,
      159,
      165,
      177,
      192,
      204,
      209,
      210,
      207,
      201,
      193,
      189,
      191,
      194,
      196,
      196,
      195,
      193,
      188,
      181,
      173,
      164,
      156,
      149,
      141,
      129,
      113,
      97,
      84,
      75,
      70,
      213,
      212,
      210,
      209,
      207,
      205,
      199,
      188,
      174,
      165,
      162,
      161,
      162,
      161,
      159,
      152,
      141,
      131,
      125,
      124,
      124,
      125,
      127,
      134,
      145,
      155,
      164,
      170,
      174,
      178,
      183,
      189,
      197,
      204,
      210,
      216,
      223,
      230,
      237,
      243,
      248,
      253,
      256,
      260,
      263,
      265,
      267,
      268,
      269,
      269,
      270,
      270,
      270,
      269,
      269,
      268,
      267,
      265,
      262,
      258,
      253,
      247,
      240,
      232,
      223,
      213,
      202,
      190,
      179,
      168,
      160,
      152,
      151,
      158,
      172,
      185,
      192,
      194,
      193,
      190,
      185,
      184,
      187,
      190,
      192,
      192,
      192,
      190,
      186,
      180,
      173,
      165,
      157,
      150,
      144,
      136,
      125,
      113,
      100,
      88,
      79,
      200,
      198,
      198,
      198,
      198,
      196,
      192,
      183,
      170,
      161,
      157,
      155,
      155,
      154,
      150,
      141,
      128,
      116,
      110,
      109,
      109,
      110,
      113,
      121,
      134,
      146,
      157,
      164,
      170,
      175,
      181,
      189,
      197,
      205,
      212,
      219,
      226,
      233,
      239,
      244,
      249,
      253,
      256,
      259,
      261,
      263,
      264,
      265,
      266,
      267,
      267,
      267,
      267,
      267,
      266,
      266,
      265,
      263,
      261,
      257,
      252,
      246,
      240,
      232,
      223,
      213,
      202,
      191,
      179,
      169,
      158,
      147,
      140,
      144,
      156,
      169,
      177,
      179,
      179,
      177,
      175,
      175,
      178,
      182,
      184,
      184,
      184,
      183,
      181,
      178,
      172,
      165,
      158,
      152,
      147,
      142,
      136,
      127,
      115,
      100,
      87,
      187,
      185,
      186,
      186,
      186,
      186,
      183,
      176,
      166,
      156,
      150,
      146,
      145,
      144,
      140,
      130,
      115,
      102,
      95,
      94,
      95,
      97,
      102,
      112,
      128,
      142,
      153,
      161,
      168,
      174,
      182,
      190,
      199,
      208,
      215,
      223,
      229,
      235,
      241,
      245,
      249,
      253,
      256,
      258,
      260,
      261,
      262,
      263,
      264,
      265,
      265,
      265,
      265,
      265,
      264,
      263,
      262,
      260,
      258,
      254,
      250,
      245,
      238,
      231,
      222,
      212,
      202,
      190,
      179,
      168,
      157,
      144,
      135,
      136,
      146,
      158,
      165,
      167,
      167,
      165,
      163,
      163,
      167,
      171,
      174,
      175,
      175,
      176,
      176,
      174,
      171,
      167,
      161,
      156,
      151,
      147,
      144,
      138,
      126,
      111,
      95,
      177,
      174,
      173,
      174,
      174,
      174,
      172,
      167,
      159,
      150,
      142,
      137,
      134,
      133,
      129,
      119,
      105,
      91,
      84,
      83,
      85,
      88,
      96,
      109,
      126,
      142,
      154,
      162,
      170,
      177,
      184,
      193,
      203,
      211,
      219,
      226,
      233,
      238,
      242,
      246,
      249,
      253,
      255,
      257,
      258,
      259,
      260,
      261,
      262,
      263,
      263,
      263,
      263,
      262,
      261,
      260,
      258,
      256,
      253,
      250,
      246,
      241,
      235,
      227,
      219,
      210,
      200,
      189,
      178,
      167,
      156,
      143,
      132,
      131,
      140,
      150,
      156,
      158,
      157,
      155,
      152,
      152,
      155,
      160,
      164,
      167,
      169,
      171,
      173,
      173,
      172,
      170,
      166,
      161,
      156,
      153,
      150,
      145,
      136,
      121,
      103,
      167,
      162,
      160,
      160,
      160,
      160,
      159,
      156,
      149,
      141,
      133,
      127,
      125,
      124,
      120,
      111,
      98,
      85,
      79,
      78,
      81,
      86,
      96,
      111,
      129,
      145,
      157,
      166,
      174,
      181,
      189,
      198,
      207,
      215,
      223,
      230,
      235,
      239,
      243,
      246,
      249,
      252,
      254,
      256,
      257,
      258,
      258,
      259,
      260,
      260,
      261,
      261,
      261,
      260,
      258,
      256,
      254,
      251,
      248,
      244,
      240,
      235,
      229,
      222,
      214,
      205,
      196,
      186,
      176,
      166,
      154,
      141,
      130,
      127,
      133,
      141,
      147,
      148,
      148,
      146,
      143,
      141,
      144,
      149,
      156,
      161,
      165,
      170,
      173,
      175,
      175,
      174,
      171,
      167,
      162,
      159,
      156,
      151,
      142,
      128,
      110,
      158,
      151,
      148,
      147,
      146,
      146,
      144,
      142,
      138,
      132,
      125,
      121,
      119,
      117,
      113,
      104,
      93,
      82,
      76,
      77,
      81,
      89,
      100,
      116,
      134,
      149,
      161,
      170,
      179,
      187,
      195,
      203,
      212,
      219,
      226,
      232,
      236,
      240,
      243,
      246,
      249,
      251,
      253,
      254,
      255,
      255,
      256,
      257,
      257,
      258,
      258,
      258,
      258,
      257,
      255,
      253,
      251,
      247,
      242,
      238,
      234,
      229,
      222,
      214,
      205,
      197,
      189,
      181,
      172,
      163,
      152,
      139,
      126,
      121,
      124,
      131,
      136,
      139,
      139,
      137,
      135,
      132,
      132,
      137,
      146,
      155,
      163,
      169,
      174,
      176,
      177,
      177,
      175,
      172,
      168,
      165,
      161,
      155,
      146,
      132,
      114,
      148,
      140,
      136,